{
  "id" : "b38892d6-d204-3397-b598-f3d9d93273e1",
  "prefix" : "AHJMYUWW",
  "name" : "RXNFMQGE",
  "type" : "JTGD",
  "series" : "XKRPVMWMMP",
  "localizedData" : {
    "de" : {
      "prefix" : "HTNSKCWA",
      "name" : "IWSNLZXIFF"
    },
    "fr" : {
      "prefix" : "YHUF",
      "name" : "JCMX"
    },
    "ko" : {
      "prefix" : "LWRKVM",
      "name" : "OZGBO"
    }
  }
}